{"schema_version":"2.2.0","source_receipt_id":"sr_0qx6fnk7aez2awdfvm566q6m92","source_sha256":"bf629d4b425db4e842e66a5ed2304a334ca51a6b2ed45b2986517cfa6ec6c7ae","content_type":"application/pdf","upload_id":"upl_ve5hmh4je890qggpdvvyb9zr7q","auth":{"event_id":"bbbbbbbbbbbbbbbbbbbbbbbbbbbbbbbbbbbbbbbbbbbbbbbbbbbbbbbbbbbbbbbb","principal_id":"aaaaaaaaaaaaaaaaaaaaaaaaaaaaaaaaaaaaaaaaaaaaaaaaaaaaaaaaaaaaaaaa","method":"POST","url":"/v2/knowledge_ingest_async","created_at":1780000000,"expires_at":1780000060,"payload_canonicalization":"rfc8785-json-excluding-auth","payload_sha256":"cccccccccccccccccccccccccccccccccccccccccccccccccccccccccccccccc","collection":"nanolime"}}
